{
  "$schema": "https://groovy-lsp.dev/schemas/jenkins-enrichment-2025-12-21.json",
  "version": "1.0.0",
  "steps": {
    "sh": {
      "plugin": "workflow-durable-task-step",
      "description": "Execute a shell script on a node.",
      "documentationUrl": "https://www.jenkins.io/doc/pipeline/steps/workflow-durable-task-step/#sh-shell-script",
      "category": "utility",
      "examples": [
        "sh 'echo Hello'"
      ],
      "parameterEnrichment": {
        "script": {
          "description": "The shell script to execute.",
          "required": true,
          "examples": [
            "echo 'test'"
          ]
        },
        "returnStdout": {
          "description": "If true, return stdout from the script instead of printing it.",
          "required": false,
          "examples": [
            "true"
          ]
        },
        "returnStatus": {
          "description": "If true, return the exit status instead of failing the build.",
          "required": false,
          "examples": [
            "true"
          ]
        }
      }
    },
    "bat": {
      "plugin": "workflow-durable-task-step",
      "description": "Execute a Windows batch script on a node.",
      "documentationUrl": "https://www.jenkins.io/doc/pipeline/steps/workflow-durable-task-step/#bat-windows-batch-script",
      "category": "utility",
      "examples": [
        "bat 'echo Hello'"
      ],
      "parameterEnrichment": {
        "script": {
          "description": "The batch script to execute.",
          "required": true,
          "examples": [
            "echo test"
          ]
        }
      }
    },
    "echo": {
      "plugin": "workflow-basic-steps",
      "description": "Print a message to the build log.",
      "documentationUrl": "https://www.jenkins.io/doc/pipeline/steps/workflow-basic-steps/#echo-print-message",
      "category": "utility",
      "examples": [
        "echo 'Hello World'"
      ],
      "parameterEnrichment": {
        "message": {
          "description": "Text to print.",
          "required": true,
          "examples": [
            "Build started"
          ]
        }
      }
    },
    "error": {
      "plugin": "workflow-basic-steps",
      "description": "Fail the build with an error message.",
      "documentationUrl": "https://www.jenkins.io/doc/pipeline/steps/workflow-basic-steps/#error-error-signal",
      "category": "utility",
      "examples": [
        "error('Something went wrong')"
      ],
      "parameterEnrichment": {
        "message": {
          "description": "Error message to display.",
          "required": true,
          "examples": [
            "Invalid configuration"
          ]
        }
      }
    },
    "checkout": {
      "plugin": "workflow-scm-step",
      "description": "Check out from a version control system using an SCM definition.",
      "documentationUrl": "https://www.jenkins.io/doc/pipeline/steps/workflow-scm-step/#checkout-general-scm",
      "category": "scm",
      "examples": [
        "checkout scm"
      ]
    },
    "git": {
      "plugin": "git",
      "description": "Check out from a Git repository.",
      "documentationUrl": "https://www.jenkins.io/doc/pipeline/steps/git/#git-git",
      "category": "scm",
      "examples": [
        "git 'https://github.com/OWNER/REPO.git'"
      ],
      "parameterEnrichment": {
        "url": {
          "description": "Repository URL.",
          "required": true,
          "examples": [
            "https://github.com/OWNER/REPO.git"
          ]
        },
        "branch": {
          "description": "Branch name to check out.",
          "required": false,
          "examples": [
            "main"
          ]
        }
      }
    },
    "stage": {
      "plugin": "pipeline-stage-step",
      "description": "Define a stage in the pipeline for visualization and scoping.",
      "documentationUrl": "https://www.jenkins.io/doc/pipeline/steps/pipeline-stage-step/#stage-stage",
      "category": "utility",
      "examples": [
        "stage('Build') { echo 'Building' }"
      ]
    },
    "timeout": {
      "plugin": "workflow-basic-steps",
      "description": "Enforce a time limit on the body of the step.",
      "documentationUrl": "https://www.jenkins.io/doc/pipeline/steps/workflow-basic-steps/#timeout-enforce-time-limit",
      "category": "utility",
      "examples": [
        "timeout(time: 5, unit: 'MINUTES') { sh 'make test' }"
      ],
      "parameterEnrichment": {
        "time": {
          "description": "Timeout duration.",
          "required": true,
          "examples": [
            "5"
          ]
        },
        "unit": {
          "description": "Time unit.",
          "required": false,
          "validValues": [
            "NANOSECONDS",
            "MICROSECONDS",
            "MILLISECONDS",
            "SECONDS",
            "MINUTES",
            "HOURS",
            "DAYS"
          ],
          "examples": [
            "MINUTES"
          ]
        }
      }
    },
    "retry": {
      "plugin": "workflow-basic-steps",
      "description": "Retry the body up to N times.",
      "documentationUrl": "https://www.jenkins.io/doc/pipeline/steps/workflow-basic-steps/#retry-retry-the-body-up-to-n-times",
      "category": "utility",
      "examples": [
        "retry(3) { sh 'flaky-command' }"
      ],
      "parameterEnrichment": {
        "count": {
          "description": "Number of retries.",
          "required": true,
          "examples": [
            "3"
          ]
        }
      }
    },
    "parallel": {
      "plugin": "workflow-cps",
      "description": "Run multiple branches of steps in parallel.",
      "documentationUrl": "https://www.jenkins.io/doc/pipeline/steps/workflow-cps/#parallel-execute-in-parallel",
      "category": "utility",
      "examples": [
        "parallel a: { sh 'make test' }, b: { sh 'make lint' }"
      ],
      "parameterEnrichment": {
        "failFast": {
          "description": "If true, abort other branches when one fails.",
          "required": false,
          "examples": [
            "true"
          ]
        }
      }
    },
    "stash": {
      "plugin": "workflow-basic-steps",
      "description": "Stash files for later use in the build.",
      "documentationUrl": "https://www.jenkins.io/doc/pipeline/steps/workflow-basic-steps/#stash-stash-some-files-to-be-used-later-in-the-build",
      "category": "utility",
      "examples": [
        "stash name: 'dist', includes: 'build/**'"
      ],
      "parameterEnrichment": {
        "name": {
          "description": "Stash name.",
          "required": true,
          "examples": [
            "dist"
          ]
        },
        "includes": {
          "description": "Ant-style include pattern.",
          "required": false,
          "examples": [
            "build/**"
          ]
        },
        "excludes": {
          "description": "Ant-style exclude pattern.",
          "required": false,
          "examples": [
            "**/*.tmp"
          ]
        }
      }
    },
    "unstash": {
      "plugin": "workflow-basic-steps",
      "description": "Restore files previously stashed.",
      "documentationUrl": "https://www.jenkins.io/doc/pipeline/steps/workflow-basic-steps/#unstash-restore-files-previously-stashed",
      "category": "utility",
      "examples": [
        "unstash 'dist'"
      ],
      "parameterEnrichment": {
        "name": {
          "description": "Stash name.",
          "required": true,
          "examples": [
            "dist"
          ]
        }
      }
    },
    "archiveArtifacts": {
      "plugin": "workflow-basic-steps",
      "description": "Archive the artifacts from the build.",
      "documentationUrl": "https://www.jenkins.io/doc/pipeline/steps/workflow-basic-steps/#archiveartifacts-archive-the-artifacts",
      "category": "build",
      "examples": [
        "archiveArtifacts artifacts: 'build/libs/*.jar', fingerprint: true"
      ],
      "parameterEnrichment": {
        "artifacts": {
          "description": "Ant-style include pattern for artifacts.",
          "required": true,
          "examples": [
            "build/libs/*.jar"
          ]
        },
        "fingerprint": {
          "description": "If true, fingerprint the archived artifacts.",
          "required": false,
          "examples": [
            "true"
          ]
        }
      }
    },
    "junit": {
      "plugin": "junit",
      "description": "Archive JUnit-formatted test results.",
      "documentationUrl": "https://www.jenkins.io/doc/pipeline/steps/junit/#junit-archive-junit-formatted-test-results",
      "category": "test",
      "examples": [
        "junit 'build/test-results/test/*.xml'"
      ],
      "parameterEnrichment": {
        "testResults": {
          "description": "Ant-style pattern for test report XML files.",
          "required": true,
          "examples": [
            "build/test-results/test/*.xml"
          ]
        }
      }
    },
    "input": {
      "plugin": "pipeline-input-step",
      "description": "Pause the pipeline and wait for human input.",
      "documentationUrl": "https://www.jenkins.io/doc/pipeline/steps/pipeline-input-step/#input-wait-for-interactive-input",
      "category": "utility",
      "examples": [
        "input message: 'Deploy to production?', ok: 'Deploy'"
      ],
      "parameterEnrichment": {
        "message": {
          "description": "Message to show in the input prompt.",
          "required": true,
          "examples": [
            "Deploy to production?"
          ]
        },
        "ok": {
          "description": "Label for the proceed button.",
          "required": false,
          "examples": [
            "Deploy"
          ]
        }
      }
    },
    "build": {
      "plugin": "pipeline-build-step",
      "description": "Trigger another job.",